{"specspine":3,"project":"cli-sdk-en-01","implementation_freedom":"contract-equivalent","areas":[
{"owner":"command-dispatch","facets":{"architecture":"complete","behavior":"not-applicable","interfaces":"not-applicable","data":"not-applicable","failure":"not-applicable","quality":"not-applicable","verification":"not-applicable"},"blockers":[]},
{"owner":"configuration-resolution","facets":{"architecture":"complete","behavior":"not-applicable","interfaces":"not-applicable","data":"not-applicable","failure":"not-applicable","quality":"not-applicable","verification":"not-applicable"},"blockers":[]},
{"owner":"credential-store","facets":{"architecture":"complete","behavior":"not-applicable","interfaces":"not-applicable","data":"not-applicable","failure":"not-applicable","quality":"not-applicable","verification":"not-applicable"},"blockers":[]},
{"owner":"error-contract","facets":{"architecture":"complete","behavior":"not-applicable","interfaces":"not-applicable","data":"not-applicable","failure":"not-applicable","quality":"not-applicable","verification":"not-applicable"},"blockers":[]},
{"owner":"local-cache","facets":{"architecture":"complete","behavior":"not-applicable","interfaces":"not-applicable","data":"not-applicable","failure":"not-applicable","quality":"not-applicable","verification":"not-applicable"},"blockers":[]},
{"owner":"migration-locking","facets":{"architecture":"complete","behavior":"not-applicable","interfaces":"not-applicable","data":"not-applicable","failure":"not-applicable","quality":"not-applicable","verification":"not-applicable"},"blockers":[]},
{"owner":"migration-planning","facets":{"architecture":"complete","behavior":"not-applicable","interfaces":"not-applicable","data":"not-applicable","failure":"not-applicable","quality":"not-applicable","verification":"not-applicable"},"blockers":[]},
{"owner":"output-rendering","facets":{"architecture":"complete","behavior":"not-applicable","interfaces":"not-applicable","data":"not-applicable","failure":"not-applicable","quality":"not-applicable","verification":"not-applicable"},"blockers":[]},
{"owner":"plugin-api","facets":{"architecture":"complete","behavior":"not-applicable","interfaces":"not-applicable","data":"not-applicable","failure":"not-applicable","quality":"not-applicable","verification":"not-applicable"},"blockers":[]},
{"owner":"profile-inheritance","facets":{"architecture":"complete","behavior":"not-applicable","interfaces":"not-applicable","data":"not-applicable","failure":"not-applicable","quality":"not-applicable","verification":"not-applicable"},"blockers":[]},
{"owner":"release-compatibility","facets":{"architecture":"complete","behavior":"not-applicable","interfaces":"not-applicable","data":"not-applicable","failure":"not-applicable","quality":"not-applicable","verification":"not-applicable"},"blockers":[]},
{"owner":"rollback-policy","facets":{"architecture":"complete","behavior":"not-applicable","interfaces":"not-applicable","data":"not-applicable","failure":"not-applicable","quality":"not-applicable","verification":"not-applicable"},"blockers":[]},
{"owner":"telemetry","facets":{"architecture":"complete","behavior":"not-applicable","interfaces":"not-applicable","data":"not-applicable","failure":"not-applicable","quality":"not-applicable","verification":"not-applicable"},"blockers":[]},
{"owner":"testing-strategy","facets":{"architecture":"complete","behavior":"not-applicable","interfaces":"not-applicable","data":"not-applicable","failure":"not-applicable","quality":"not-applicable","verification":"not-applicable"},"blockers":[]}],"assets":[]}
