{"specspine":3,"project":"backend-service-en-01","implementation_freedom":"contract-equivalent","areas":[
{"owner":"authentication","facets":{"architecture":"complete","behavior":"not-applicable","interfaces":"not-applicable","data":"not-applicable","failure":"not-applicable","quality":"not-applicable","verification":"not-applicable"},"blockers":[]},
{"owner":"authorization","facets":{"architecture":"complete","behavior":"not-applicable","interfaces":"not-applicable","data":"not-applicable","failure":"not-applicable","quality":"not-applicable","verification":"not-applicable"},"blockers":[]},
{"owner":"background-jobs","facets":{"architecture":"complete","behavior":"not-applicable","interfaces":"not-applicable","data":"not-applicable","failure":"not-applicable","quality":"not-applicable","verification":"not-applicable"},"blockers":[]},
{"owner":"carrier-integration","facets":{"architecture":"complete","behavior":"not-applicable","interfaces":"not-applicable","data":"not-applicable","failure":"not-applicable","quality":"not-applicable","verification":"not-applicable"},"blockers":[]},
{"owner":"configuration","facets":{"architecture":"complete","behavior":"not-applicable","interfaces":"not-applicable","data":"not-applicable","failure":"not-applicable","quality":"not-applicable","verification":"not-applicable"},"blockers":[]},
{"owner":"http-request-pipeline","facets":{"architecture":"complete","behavior":"not-applicable","interfaces":"not-applicable","data":"not-applicable","failure":"not-applicable","quality":"not-applicable","verification":"not-applicable"},"blockers":[]},
{"owner":"incident-response","facets":{"architecture":"complete","behavior":"not-applicable","interfaces":"not-applicable","data":"not-applicable","failure":"not-applicable","quality":"not-applicable","verification":"not-applicable"},"blockers":[]},
{"owner":"observability","facets":{"architecture":"complete","behavior":"not-applicable","interfaces":"not-applicable","data":"not-applicable","failure":"not-applicable","quality":"not-applicable","verification":"not-applicable"},"blockers":[]},
{"owner":"order-lifecycle","facets":{"architecture":"complete","behavior":"not-applicable","interfaces":"not-applicable","data":"not-applicable","failure":"not-applicable","quality":"not-applicable","verification":"not-applicable"},"blockers":[]},
{"owner":"payment-processing","facets":{"architecture":"complete","behavior":"not-applicable","interfaces":"not-applicable","data":"not-applicable","failure":"not-applicable","quality":"not-applicable","verification":"not-applicable"},"blockers":[]},
{"owner":"persistence","facets":{"architecture":"complete","behavior":"not-applicable","interfaces":"not-applicable","data":"not-applicable","failure":"not-applicable","quality":"not-applicable","verification":"not-applicable"},"blockers":[]},
{"owner":"rate-limits","facets":{"architecture":"complete","behavior":"not-applicable","interfaces":"not-applicable","data":"not-applicable","failure":"not-applicable","quality":"not-applicable","verification":"not-applicable"},"blockers":[]},
{"owner":"retry-policy","facets":{"architecture":"complete","behavior":"not-applicable","interfaces":"not-applicable","data":"not-applicable","failure":"not-applicable","quality":"not-applicable","verification":"not-applicable"},"blockers":[]},
{"owner":"webhook-delivery","facets":{"architecture":"complete","behavior":"not-applicable","interfaces":"not-applicable","data":"not-applicable","failure":"not-applicable","quality":"not-applicable","verification":"not-applicable"},"blockers":[]}],"assets":[]}
